{
    "Disease 1": "Tetanus",
    "Disease 2": "Hepatitis",
    "Keyword": "Adults",
    "Master Answer": "You can get publicly-funded (free) vaccines from your community health centre, most pharmacies, and some doctors' offices. You can purchase non-publicly funded vaccines at most pharmacies and travel clinics. Services vary throughout B.C.\u00a0 A booster dose of Tetanus and diphtheria is recommended every 10 years and is free. Hepatitis A is only publicly funded (free) for Aboriginal children and adolescents aged 6 months to 18 years and people at high risk of hepatitis A infection, such as people with chronic liver disease, people who use injection drugs, and men who have sex with men.\nTo find out what other vaccines adults in BC may need, check here.\nImmunization Nurse\n\u00a0\n",
    "Master Question": "I'm 25 years old. All my immunizations are up-to-date as of grade 9, which was over a decade ago. Where can I access the free immunizations offered, such as tetanus and Hep A?\n",
    "Other -condition, symptom etc": "",
    "Subject - Person": "Adult",
    "Subject 1 - Immunization": "Immunization Schedule",
    "Subject 2 - Vaccination / General": "Vaccine Cost",
    "Vaccine 1": "Tetanus",
    "Vaccine 2": "Hepatitis A",
    "Who is writing this": "Adult"
}